<!ELEMENT FontPack (ButtonFont, DefaultFont, InputFont, TitleFont, InfoFont, CustomFont*) >
	<!ELEMENT ButtonFont  (Name, Size, FontStyle*) >
	<!ELEMENT DefaultFont (Name, Size, FontStyle*) >
	<!ELEMENT InputFont   (Name, Size, FontStyle*) >
	<!ELEMENT TitleFont   (Name, Size, FontStyle*) >
	<!ELEMENT InfoFont   (Name, Size, FontStyle*) >
	<!ELEMENT CustomFont   (Name, Size, FontStyle*) >
	<!ATTLIST CustomFont name CDATA #REQUIRED >
		<!ELEMENT Name      (#PCDATA) >
		<!ELEMENT Size      (#PCDATA) >
		<!ELEMENT FontStyle (#PCDATA) >